Ruby Gem: websocket-driver,WebSocket protocol handler with pluggable I/O,MIT,https://github.com/faye/websocket-driver-ruby
Ruby Gem: websocket-extensions,Generic extension manager for WebSocket connections,MIT,https://github.com/faye/websocket-extensions-ruby
Ruby Gem: xpath,Generate XPath expressions from Ruby,MIT,https://github.com/teamcapybara/xpath
Ruby Gem: ya2yaml,An UTF8 safe YAML dumper.,MIT,http://rubyforge.org/projects/ya2yaml/
Ruby Gem: addressable,URI Implementation,Apache 2.0,https://github.com/sporkmonger/addressable
Ruby Gem: elasticsearch,Ruby integrations for Elasticsearch,Apache 2.0,http://github.com/elasticsearch/elasticsearch-ruby
Ruby Gem: elasticsearch-api,Ruby API for Elasticsearch.,Apache 2.0,https://github.com/elasticsearch/elasticsearch-ruby/tree/master/elasticsearch-api
Ruby Gem: elasticsearch-model,ActiveModel/Record integrations for Elasticsearch.,Apache 2.0,https://github.com/elasticsearch/elasticsearch-rails/
Ruby Gem: elasticsearch-persistence,Persistence layer for Ruby models and Elasticsearch.,Apache 2.0,https://github.com/elasticsearch/elasticsearch-rails/
Ruby Gem: elasticsearch-transport,Ruby client for Elasticsearch.,Apache 2.0,https://github.com/elasticsearch/elasticsearch-ruby/tree/master/elasticsearch-transport
Ruby Gem: google-api-client,Client for accessing Google APIs,Apache 2.0,https://github.com/google/google-api-ruby-client
Ruby Gem: googleauth,Google Auth Library for Ruby,Apache 2.0,https://github.com/google/google-auth-library-ruby
Ruby Gem: signet,Signet is an OAuth 1.0 / OAuth 2.0 implementation.,Apache 2.0,https://github.com/google/signet/
Ruby Gem: thread_safe,Thread-safe collections and utilities for Ruby,Apache 2.0,https://github.com/ruby-concurrency/thread_safe
Ruby Gem: twitter-text,Twitter text handling library,Apache 2.0,http://twitter.com
Ruby Gem: activerecord-import,Bulk insert extension for ActiveRecord,Ruby,http://github.com/zdennis/activerecord-import
Ruby Gem: eventmachine,Ruby/EventMachine library,Ruby,http://rubyeventmachine.com
Ruby Gem: httpclient,gives something like the functionality of libwww-perl (LWP) in Ruby,Ruby,https://github.com/nahi/httpclient
Ruby Gem: json,JSON Implementation for Ruby,Ruby,http://flori.github.com/json
Ruby Gem: rdoc,RDoc produces HTML and command-line documentation for Ruby projects,Ruby,http://docs.seattlerb.org/rdoc
Ruby Gem: thin,A thin and fast web server,Ruby,http://code.macournoyer.com/thin/
Ruby Gem: domain_name,Domain Name manipulation library for Ruby,bsd-3-clause,https://github.com/knu/ruby-domain_name
Ruby Gem: ffi,Ruby FFI,bsd-3-clause,http://wiki.github.com/ffi/ffi
Ruby Gem: google-protobuf,Protocol Buffers,bsd-3-clause,https://developers.google.com/protocol-buffers
Ruby Gem: google_drive,A library to read/write files/spreadsheets in Google Drive/Docs.,bsd-3-clause,https://github.com/gimite/google-drive-ruby
Ruby Gem: pg,Pg is the Ruby interface to the {PostgreSQL RDBMS}[http://www.postgresql.org/],bsd-3-clause,https://bitbucket.org/ged/ruby-pg
Ruby Gem: pg_query,PostgreSQL query parsing and normalization library,bsd-3-clause,http://github.com/lfittl/pg_query
Ruby Gem: puma,Puma is a simple fast threaded and highly concurrent HTTP 1.1 server for Ruby/Rack applications,bsd-3-clause,http://puma.io
Ruby Gem: clamav-client,ClamAV::Client connects to a Clam Anti-Virus clam daemon and send commands.,gpl-v3,https://github.com/franckverrot/clamav-client
Ruby Gem: colorize,Ruby gem for colorizing text using ANSI escape sequences.,gpl-2.0,http://github.com/fazibear/colorize
Ruby Gem: eventmachine,Ruby/EventMachine library,gpl-2.0,http://rubyeventmachine.com
Ruby Gem: diff-lcs,Diff::LCS computes the difference between two Enumerable sequences using the McIlroy-Hunt longest common subsequence (LCS) algorithm,artistic-2.0,https://github.com/halostatue/diff-lcs
Ruby Gem: redis-objects,Map Redis types directly to Ruby objects,artistic-2.0,http://github.com/nateware/redis-objects
Ruby Gem: diff-lcs,Diff::LCS computes the difference between two Enumerable sequences using the McIlroy-Hunt longest common subsequence (LCS) algorithm,gpl-2.0+,https://github.com/halostatue/diff-lcs
Ruby Gem: domain_name,Domain Name manipulation library for Ruby,mpl-2.0,https://github.com/knu/ruby-domain_name
Ruby Gem: font-awesome-rails,an asset gemification of the font-awesome icon font library,sil open font license,https://github.com/bokmann/font-awesome-rails
Ruby Gem: geojsonlint,A geojson validator.,bsd 3-clause,http://github.com/can-explore/geojsonlint
Ruby Gem: promise.rb,Ruby implementation of the Promises/A+ spec,public domain,https://github.com/lgierth/promise
Ruby Gem: ntlm-http,Ruby/NTLM HTTP library.,unknown,http://www.mindflowsolutions.net
Ruby Gem: logstash-event,Library that contains the classes required to create LogStash events,apache license (2.0),https://github.com/logstash/logstash
Ruby Gem: pg_application_name,Stamp an ActiveRecord connection to a postgres database with an appropriate application_name.,new bsd license,http://github.com/fiksu/pg_application_name
Ruby Gem: railroady,Ruby on Rails 3/4 model and controller UML class diagram generator.,GPLv2,http://github.com/preston/railroady
Ruby Gem: thin,A thin and fast web server,GPLv2,http://code.macournoyer.com/thin/
Ruby Gem: rails_admin_material,RailsAdminMaterial theme,ISC,https://github.com/blocknotes/rails_admin_material
Ruby Gem: sidekiq,Simple efficient background processing for Ruby,LGPLv3,http://sidekiq.org
Ruby Gem: smooch-api,Smooch Ruby Gem,https://smooch.io/terms/,https://github.com/smooch/smooch-ruby
Ruby Gem: sqlite3,This module allows Ruby programs to interface with the SQLite3 database engine (http://www.sqlite.org),bsd-3,https://github.com/sparklemotion/sqlite3-ruby
